{
  "schema_version": "source_dataset_manifest.v0",
  "updated": "2026-06-02",
  "policy": {
    "raw_artifact_default": "Do not copy raw upstream scientific artifacts into the public handoff by default. Publish source URLs, pins, derived tool observations, verifier specs, and export rows unless license review explicitly allows raw redistribution.",
    "training_claim_gate": "A seed trajectory is training-claim eligible only when its task starts from one or more source ids in this manifest, the rollout was captured from those sources through the domain or fixture tools, and the final answer passes the deterministic verifier.",
    "recapture_rule": "If the current task observations were captured from project-local or toy repo fixtures, they remain smoke rows until recaptured from the approved public source ids listed in task-source-gate.csv."
  },
  "sources": [
    {
      "source_id": "flowcore-0877408774-e07-fcs",
      "family": "flowcyto",
      "name": "flowCore 0877408774.E07 FCS example",
      "artifact_kind": "fcs_file",
      "primary_url": "https://raw.githubusercontent.com/RGLab/flowCore/4935c7bf318697b3128ee50dae81018a6b246ab8/inst/extdata/0877408774.E07",
      "publication_tier": "public_pinned",
      "license_status": "artistic-2.0",
      "raw_artifact_policy": "copy_allowed_after_license_review",
      "pin": {
        "kind": "git_commit",
        "value": "4935c7bf318697b3128ee50dae81018a6b246ab8",
        "package_path": "flowCore/inst/extdata/0877408774.E07",
        "etag": "\"9c15c60e305c825fca67aae73643cafedab83b1bcfcd4bbbdd0da865ce73ba9a\"",
        "content_length": "162305"
      },
      "verification": {
        "method": "head",
        "expected_status": 200,
        "checked_at": "2026-06-02T11:12:08Z",
        "expected_content_type_prefix": "application/octet-stream"
      },
      "proposed_task_ids": [
        "flowcyto-gating-qc-success",
        "flowcyto-fcs-compensation-metadata-001"
      ],
      "notes": "Good first public FCS for recapturing FlowCyto gate/context/stats tasks and for metadata/compensation QC."
    },
    {
      "source_id": "flowcore-0877408774-b08-fcs",
      "family": "flowcyto",
      "name": "flowCore 0877408774.B08 FCS example",
      "artifact_kind": "fcs_file",
      "primary_url": "https://raw.githubusercontent.com/RGLab/flowCore/4935c7bf318697b3128ee50dae81018a6b246ab8/inst/extdata/0877408774.B08",
      "publication_tier": "public_pinned",
      "license_status": "artistic-2.0",
      "raw_artifact_policy": "copy_allowed_after_license_review",
      "pin": {
        "kind": "git_commit",
        "value": "4935c7bf318697b3128ee50dae81018a6b246ab8",
        "package_path": "flowCore/inst/extdata/0877408774.B08"
      },
      "verification": {
        "method": "head",
        "expected_status": 200,
        "checked_at": "2026-06-02T11:15:00Z"
      },
      "proposed_task_ids": [
        "flowcyto-gating-qc-stale-revision-failure",
        "flowcyto-gating-qc-report-validation-failure"
      ],
      "notes": "Second public FCS from the same pinned upstream repository. Use it to avoid all FlowCyto tasks being the same sample."
    },
    {
      "source_id": "flowcore-compmatrix",
      "family": "flowcyto",
      "name": "flowCore compensation matrix example",
      "artifact_kind": "compensation_matrix",
      "primary_url": "https://raw.githubusercontent.com/RGLab/flowCore/4935c7bf318697b3128ee50dae81018a6b246ab8/inst/extdata/compdata/compmatrix",
      "publication_tier": "public_pinned",
      "license_status": "artistic-2.0",
      "raw_artifact_policy": "copy_allowed_after_license_review",
      "pin": {
        "kind": "git_commit",
        "value": "4935c7bf318697b3128ee50dae81018a6b246ab8",
        "package_path": "flowCore/inst/extdata/compdata/compmatrix",
        "etag": "\"01cab8ac508712ec0134b24a4f93ba54ea616c32c8457d09f420d2d52fc01e1d\"",
        "content_length": "134"
      },
      "verification": {
        "method": "head",
        "expected_status": 200,
        "checked_at": "2026-06-02T11:12:08Z",
        "expected_content_type_prefix": "text/plain"
      },
      "proposed_task_ids": [
        "flowcyto-fcs-compensation-metadata-001"
      ],
      "notes": "Pairs with the flowCore FCS files for deterministic channel/compensation coverage checks."
    },
    {
      "source_id": "ncbi-nc005816-genbank",
      "family": "molecule-biology",
      "name": "NC_005816.1 plasmid pPCP1 GenBank record",
      "artifact_kind": "genbank_sequence_record",
      "primary_url": "https://eutils.ncbi.nlm.nih.gov/entrez/eutils/efetch.fcgi?db=nuccore&id=NC_005816.1&rettype=gb&retmode=text",
      "publication_tier": "public_versioned_database",
      "license_status": "public_database_policy_review_pending",
      "raw_artifact_policy": "link_only_publish_derived_observations",
      "pin": {
        "kind": "accession_version",
        "value": "NC_005816.1"
      },
      "verification": {
        "method": "get_headers",
        "expected_status": 200,
        "checked_at": "2026-06-02T11:10:51Z",
        "expected_content_type_prefix": "text/plain"
      },
      "proposed_task_ids": [
        "molecule-genbank-feature-annotation-001",
        "molecule-primer-validation-001",
        "molecule-restriction-digest-001"
      ],
      "notes": "Real circular plasmid record with features; use accession/version as the stable pin and recapture through molecule-biology tools."
    },
    {
      "source_id": "ncbi-nc005816-fasta",
      "family": "molecule-biology",
      "name": "NC_005816.1 plasmid pPCP1 FASTA record",
      "artifact_kind": "fasta_sequence_record",
      "primary_url": "https://eutils.ncbi.nlm.nih.gov/entrez/eutils/efetch.fcgi?db=nuccore&id=NC_005816.1&rettype=fasta&retmode=text",
      "publication_tier": "public_versioned_database",
      "license_status": "public_database_policy_review_pending",
      "raw_artifact_policy": "link_only_publish_derived_observations",
      "pin": {
        "kind": "accession_version",
        "value": "NC_005816.1"
      },
      "verification": {
        "method": "get_headers",
        "expected_status": 200,
        "checked_at": "2026-06-02T11:12:56Z",
        "expected_content_type_prefix": "text/plain"
      },
      "proposed_task_ids": [
        "molecule-fasta-import-context-001"
      ],
      "notes": "Replacement for the current 15 bp toy FASTA fixture."
    },
    {
      "source_id": "ncbi-nc001416-genbank",
      "family": "molecule-biology",
      "name": "NC_001416.1 bacteriophage lambda GenBank record",
      "artifact_kind": "genbank_sequence_record",
      "primary_url": "https://eutils.ncbi.nlm.nih.gov/entrez/eutils/efetch.fcgi?db=nuccore&id=NC_001416.1&rettype=gb&retmode=text",
      "publication_tier": "public_versioned_database",
      "license_status": "public_database_policy_review_pending",
      "raw_artifact_policy": "link_only_publish_derived_observations",
      "pin": {
        "kind": "accession_version",
        "value": "NC_001416.1"
      },
      "verification": {
        "method": "get_headers",
        "expected_status": 200,
        "checked_at": "2026-06-02T11:10:49Z",
        "expected_content_type_prefix": "text/plain"
      },
      "proposed_task_ids": [
        "molecule-pcr-simulation-001",
        "molecule-genbank-feature-annotation-001"
      ],
      "notes": "Real linear sequence record for PCR and feature annotation tasks."
    },
    {
      "source_id": "ncbi-nc001416-fasta",
      "family": "molecule-biology",
      "name": "NC_001416.1 bacteriophage lambda FASTA record",
      "artifact_kind": "fasta_sequence_record",
      "primary_url": "https://eutils.ncbi.nlm.nih.gov/entrez/eutils/efetch.fcgi?db=nuccore&id=NC_001416.1&rettype=fasta&retmode=text",
      "publication_tier": "public_versioned_database",
      "license_status": "public_database_policy_review_pending",
      "raw_artifact_policy": "link_only_publish_derived_observations",
      "pin": {
        "kind": "accession_version",
        "value": "NC_001416.1"
      },
      "verification": {
        "method": "get_headers",
        "expected_status": 200,
        "checked_at": "2026-06-02T11:12:56Z",
        "expected_content_type_prefix": "text/plain"
      },
      "proposed_task_ids": [
        "molecule-fasta-import-context-001"
      ],
      "notes": "Second real FASTA source for expansion; keep one FASTA task on pPCP1 and reserve this for scale."
    },
    {
      "source_id": "multiqc-fastqc-nan-reads",
      "family": "scientific-data-qc",
      "name": "MultiQC FastQC nanopore read report",
      "artifact_kind": "fastqc_report",
      "primary_url": "https://raw.githubusercontent.com/MultiQC/test-data/84dc905e6edb97668b87660896dfd78f175008ca/data/modules/fastqc/nan_reads/fastqc_data.txt",
      "publication_tier": "public_pinned",
      "license_status": "raw_copy_license_review_pending",
      "raw_artifact_policy": "link_only_publish_derived_observations",
      "pin": {
        "kind": "git_commit",
        "value": "84dc905e6edb97668b87660896dfd78f175008ca",
        "etag": "\"ab8d2041df37698afb21c147042360174aadbbe97e976c6cfbd677141bbb561f\"",
        "content_length": "107864"
      },
      "verification": {
        "method": "head",
        "expected_status": 200,
        "checked_at": "2026-06-02T11:12:43Z",
        "expected_content_type_prefix": "text/plain"
      },
      "proposed_task_ids": [
        "fastq-qc-nanopore-fail-001"
      ],
      "notes": "Current seed source for FastQC QC; publish parser observations and evidence refs first."
    },
    {
      "source_id": "multiqc-qualimap-zero-aligned",
      "family": "scientific-data-qc",
      "name": "MultiQC Qualimap low-mapQ report",
      "artifact_kind": "qualimap_bamqc_report",
      "primary_url": "https://raw.githubusercontent.com/MultiQC/test-data/84dc905e6edb97668b87660896dfd78f175008ca/data/modules/qualimap/bam_qc/issue_2199_zero_aligned/genome_results.txt",